### ISSUE TITLE
two webboxes on the same integration

### ISSUE THREAD

**Issue by gianbooo** [jpcornil-git/HA-sma#35]
Hello,
I have an issue when connecting 2 webbox to the same HA integration with 2 different IP (192.168.15.168 and 192.168.0.224), HA is on 192.168.0.*
One of them is working for a while and then stop working and become not reachable with the following message: "Unable to create SMA Webbox model from device at 192.168.0.224:34268 (RPC request timed out)"
The only way to make it working is to delete the webbox that does not respond, reload the integration from HACS (deleting the __pycache__ directory) and add again the .224 webbox.

The sma_webbox.py script that call the same ip is working while the webbox is out of reach.

After a few working days the issue comes back for no apparent reasons.

**Comment by gianbooo** [comment]
[home-assistant_2026-08-16T07-31-39.356Z.log.zip](https://github.com/user-attachments/files/31113692/home-assistant_2026-08-16T07-31-39.356Z.log.zip)

here is the log after 3 days of working it stopped... and it seems after upgranding HAOS to 2026.8.2 but I am not 100% sure of that

**Comment by jpcornil-git** [comment]
Just had a look at your logs:

- 13/08 - 15/08 7:11 ~20 timeout/day for the sma_webbox integration (can't say if it is only .224 or both)
There is a connectivity issue here already but because the two instances successfully initialized when HA started, the only impact is that data won't be updated for the corresponding webbox instance(s).
- 15/08 7:11 HA shutdown => 15/08 9:11 HA restart
HAOS upgrade I guess
- A number of timout are visible as before
- 16/08 9:30 Debug enabled for sma_webbox (and integration reloaded ?)
   - 192.168.15.168 always OK
   - 192.168.0.224 timing out/instance can't be created (attemps at 09:30:25, 09:30:35, 09:30:51, 09:31:16) -> ConfigEntryNotReady exception raised and retrying forever (but never OK apparently)

It looks like the .224 device is not answering for some reasons (I see it is on a different subnet 192.168.15.x vs 192.169.0.x) and I suspect therefore a network connectivity issue.

WHen there is a faulure, can you ping 192.168.0.224 from a terminal  in HAOS ?

Could you also supply the two lines from .storage/ core.config_entries corresponding to your two webbox (look for sma_webbox) ?

**Comment by gianbooo** [comment]
0.224 is on the same subnet as HA and is connected via a lan cable
15.168 is on another subnet and is connected to HA via router, switch, WIFI CPE AP, CPE Client AP, switch, webbox.
I expect that the most troublesome should be 15.168 but it's the one that never stops, and I am almost certain that the wifi bridge is not a rockstable connection

When I have the issue I can ping the 224 from the HA terminal, it was one of the first thing tried I remember. I can try once more the next time that the issue comes back.

Another method to restore the integration is to disable the integration, wait a few minutes, restart HA, enable the integration, restart HA again ant it works (not all the times tough)

here the core.config_entries whole file, since weebox is found in several lines

[core.config_entries.zip](https://github.com/user-attachments/files/31138125/core.config_entries.zip)

**Comment by jpcornil-git** [comment]
Nothing abnormal in your file (deleted it as it contains clear password for some integrations)
```
      {"created_at":"2026-06-15T17:09:59.213197+00:00","data":{"ip_address":"192.168.15.168","port":34268,"scan_interval":30},"disabled_by":null,"discovery_keys":{},"domain":"sma_webbox","entry_id":"01KV645VSDKAR64R3F7ZNATKAN","minor_version":1,"modified_at":"2026-07-29T05:53:34.354893+00:00","options":{"scan_interval":35,"timeout":8},"pref_disable_new_entities":false,"pref_disable_polling":false,"source":"user","subentries":[],"title":"192.168.15.168","unique_id":"192.168.15.168-34268","version":1},

      {"created_at":"2026-08-16T16:40:43.710568+00:00","data":{"ip_address":"192.168.0.224","port":34268,"scan_interval":30},"disabled_by":null,"discovery_keys":{},"domain":"sma_webbox","entry_id":"01M05Q4VDY2W9TY5BBZDMB281R","minor_version":1,"modified_at":"2026-08-16T16:41:00.932855+00:00","options":{"scan_interval":30,"timeout":10},"pref_disable_new_entities":false,"pref_disable_polling":false,"source":"user","subentries":[],"title":"192.168.0.224","unique_id":"192.168.0.224-34268","version":1}
```

Are you using config flow to setup this integration or the legacy configuration.yaml ? If the latter, could you delete sma_webbox from your configuration.yaml (it will then load the configuration directly from configflow given existing entries in  your core.config_entries).

When using the legacy configuration.yaml, the entry is loaded twice (loaded because it exists in core.config_entries then unloaded/load when the same one exists in configuration.yaml)

**Comment by gianbooo** [comment]
I am using config flow. In the beginning I have tried with configuration.yaml but gave it up when I saw it was much simpler with HACS.

Maybe some ghost stuff is left somewhere that interfere?

**Comment by jpcornil-git** [comment]
I suppose you can ping the 192.168.0.224 device from the HA terminal ?
Issue started after a restart of HA I suppose not during HA normal operation (the previous error was related to the initialization of the integration for .224)
I can also have a look at you logs file

**Comment by gianbooo** [comment]
while disconnected 224 does not ping.
reconnected it start pinging again.

With Sunnyportal it seems it never had any connection problem. What is the difference between sunnyportal and the API of your integration?

Here the log

[home-assistant_2026-08-20T08-15-17.250Z.log](https://github.com/user-attachments/files/31255412/home-assistant_2026-08-20T08-15-17.250Z.log)

**Comment by jpcornil-git** [comment]
The webbox open a tcp connection to push data to the sunnyportal on internet while this integration uses an udp connection to pull data (REST API) .

The error in the log file is the same, .0.224 can't initialize because of a timeout -> reported  issue is related to/after a restart of HA/reload of the integration (may be you did that because it was not updating data anymore) 

In HA terminal, could you run the following command:
```
tcpdump host 192.168.0.224 and udp -nn
```
if tcpcump is not available, you can install it in the HA container using:
```
apk add tcpdump
```

I would like to see if HAOS receive packets when the issue is present or not. you can do the same with 15.168 to compare

**Comment by gianbooo** [comment]
tcpdump does not work as expected.
I installed it first, then ran it for 10 minutes, then I hit the CTRL-C since nothing was showing up
Result is:
0 packets captured
0 packets received by filter
0 packets dropped by kernel

checked with ping and still 224 is pingable

**Comment by jpcornil-git** [comment]
Did you try with 15.168 ? (you should see something/traffic every 10s if this is your update interval)

**Comment by gianbooo** [comment]
I tried with 15.168 but with the same result, maybe I don't use or set correctly the tcpdump?

**Comment by jpcornil-git** [comment]
There is nothing to set a priori, here is a log from my setup (you are running this with HAOS terminal ?):
```
SynologyNas:/config# tcpdump host 192.168.1.109 and udp                          
tcpdump: verbose output suppressed, use -v[v]... for full protocol decode        
listening on eth0, link-type EN10MB (Ethernet), snapshot length 262144 bytes     
18:49:00.044863 IP 192.168.1.96.34268 > 192.168.1.109.34268: UDP, length 144     
18:49:00.142420 IP 192.168.1.109.3823 > 192.168.1.96.34268: UDP, length 872      
18:49:01.045096 IP 192.168.1.96.34268 > 192.168.1.109.34268: UDP, length 406     
18:49:01.279066 IP 192.168.1.109.3824 > 192.168.1.96.34268: UDP, length 1644     
18:49:01.279095 IP 192.168.1.109 > 192.168.1.96: udp                             
18:49:31.043887 IP 192.168.1.96.34268 > 192.168.1.109.34268: UDP, length 144     
18:49:31.142455 IP 192.168.1.109.3825 > 192.168.1.96.34268: UDP, length 872      
18:49:32.044316 IP 192.168.1.96.34268 > 192.168.1.109.34268: UDP, length 406     
18:49:32.275534 IP 192.168.1.109.3826 > 192.168.1.96.34268: UDP, length 1644     
18:49:32.275556 IP 192.168.1.109 > 192.168.1.96: udp                             
^C                                                                               
10 packets captured                                                              
10 packets received by filter                                                    
0 packets dropped by kernel 
```
If you run tcpdump without any parameter/filtering, you shoudl see a lot of traffic

**Comment by jpcornil-git** [comment]
You are probably running the default terminal (this is a separate docker container giving access to the /config directory shared with the homeassistant container  and the ha utility) not a terminal in the main HAOS (the one running all docker containers) nor a terminal in the homeassistant container.

Do you have access to HAOS ?

**Comment by gianbooo** [comment]
I am using so far the terminal from inside HA (the one on the sidebar)... 

I tried to access via macos Terminal with the ssh command to the tcp address of the HA web interface...

A simple tcpdump on host 192.168.0.224 give out no answer
a tcpdump alone give out many lines but I dont see any reference to 0.224 nor 15.168:

[tcpdump.rtf](https://github.com/user-attachments/files/31274374/tcpdump.rtf)

Please suggest me how to get access to HAOS

**Comment by jpcornil-git** [comment]
Running tcpdump on a different device/PC won't give you visibility on unicast traffic between other network devices.

To enable access to HAOS, see
https://developers.home-assistant.io/docs/operating-system/debugging/

**Comment by gianbooo** [comment]
rather complicated for my skills running tcpdump in HAOS like you suggest...

I have just experienced another process to creat e the issue:

- deleted both 15.168 and 0.224
- added first 0.224
- added second 15.168
- reboot the pc
- now the integration that does not work is 15.168

it seems like the second added integration is the cause of this issue... Do you hava someone else with double webbox that run smoothly?

PS: Now I fixed the usual way and both are working... I let them work for a while and try to guess what happen when the issue comes back

**Comment by jpcornil-git** [comment]
That is interesting indeed.

When you say PC, you mean a real x86/windows PC or the RPi ?

I don't have two webbox myself but I added that capability for others (I made a setup to test wih multiple virtual/fake webbox) and it works OK apparently.

**Comment by gianbooo** [comment]
Hi, all is fine so far. I think you can publish the release.
How can I buy you a pizza?

**Comment by jpcornil-git** [comment]
Done (you may have to trigger a download as I forgot to update the manifest file and I updated the v2.2.4 tag  -> you will effectively use v2.2.4 code but version displayed may still report v2.2.3).

Wrt pizza, many thanks but I like to help people and very glad already with a positive feedbacks like yours 👍
